{
  "schemaVersion": 1,
  "id": "builtin.gmail",
  "version": "1.0.1",
  "name": {
    "en": "Built-in Gmail",
    "zh_CN": "内置 Gmail",
    "zh_TW": "內建 Gmail"
  },
  "source": "gmail",
  "courses": [],
  "keywords": {
    "context": [
      "attendance",
      "签到",
      "簽到"
    ],
    "navigation": [
      "attendance",
      "code"
    ]
  },
  "images": {
    "selectors": [
      "img"
    ],
    "excludeSelectors": [
      ".gmail_quote img",
      "blockquote img",
      ".gmail_signature img"
    ],
    "minWidth": 60,
    "minHeight": 20,
    "maxHeight": 2000
  },
  "author": {
    "name": "mxymalay",
    "url": "https://github.com/mxymalay"
  },
  "sourceUrl": "https://github.com/mxymalay/mamo-checkin-rules/blob/main/builtin/gmail.json"
}
