{
  "schemaVersion": 1,
  "id": "community.example.gmail-images",
  "version": "1.0.1",
  "name": {
    "en": "Synthetic Gmail example",
    "zh_CN": "Gmail 合成示例",
    "zh_TW": "Gmail 合成範例"
  },
  "source": "gmail",
  "courses": [
    "DEMO1000"
  ],
  "images": {
    "selectors": [
      ".summary img"
    ],
    "minWidth": 30,
    "minHeight": 20,
    "maxHeight": 2000
  },
  "author": {
    "name": "mxymalay",
    "url": "https://github.com/mxymalay"
  },
  "sourceUrl": "https://github.com/mxymalay/mamo-checkin-rules/blob/main/examples/DEMO1000/demo-gmail.json"
}
