{
  "schemaVersion": 1,
  "id": "community.example.moodle-images",
  "version": "1.0.1",
  "name": {
    "en": "Synthetic Moodle example",
    "zh_CN": "Moodle 合成示例",
    "zh_TW": "Moodle 合成範例"
  },
  "source": "moodle",
  "courses": [
    "DEMO1000"
  ],
  "keywords": {
    "context": [
      "Attendance"
    ],
    "navigation": [
      "Weekly summary"
    ]
  },
  "images": {
    "selectors": [
      ".summary img"
    ],
    "excludeSelectors": [
      ".author img"
    ],
    "minWidth": 30,
    "minHeight": 20,
    "maxHeight": 4000
  },
  "author": {
    "name": "mxymalay",
    "url": "https://github.com/mxymalay"
  },
  "sourceUrl": "https://github.com/mxymalay/mamo-checkin-rules/blob/main/examples/DEMO1000/demo-moodle.json"
}
