{
  "schemaVersion": 1,
  "id": "builtin.moodle",
  "version": "1.0.1",
  "name": {
    "en": "Built-in Moodle",
    "zh_CN": "内置 Moodle",
    "zh_TW": "內建 Moodle"
  },
  "source": "moodle",
  "courses": [],
  "keywords": {
    "context": [
      "attendance",
      "签到",
      "簽到"
    ],
    "navigation": [
      "attendance",
      "签到",
      "簽到",
      "announcement",
      "week",
      "learning",
      "forums"
    ]
  },
  "images": {
    "selectors": [
      "img"
    ],
    "excludeSelectors": [
      "blockquote img",
      ".userpicture img",
      ".activityiconcontainer img"
    ],
    "minWidth": 60,
    "minHeight": 20,
    "maxHeight": 4000
  },
  "author": {
    "name": "mxymalay",
    "url": "https://github.com/mxymalay"
  },
  "sourceUrl": "https://github.com/mxymalay/mamo-checkin-rules/blob/main/builtin/moodle.json"
}
